How many times does the Bible mention the constellation Orion?	-0.5212
Which the term, a hapax legomenon in Job 38:32, may be the Hebrew word for the zodiacal constellations?	-1.2157
Was a god said to be the son of Sah?	-0.5212
Who cited Ptolemy as calling the star red?	-0.5212
Why did doubts continue to be expressed about Perkin-Elmer competence on a project of this importance?	-1.2157
Which is the fastest known nova?	0.1733
Was when Alpha Ursae Minoris still removed from the geographic north pole by about 8 °?	-0.5212
Does it probably arise in the Carolingian era?	-1.2157
Is less brighter stars The Baby Deer?	-1.2157
Have a few other such stars been identified?	-1.2157
When was Chen Zhuo an astronomer?	0.8678
Did the Babylonian star catalogues of the Late Bronze Age name Orion MULSIPA.ZI.AN.NA?	-1.2157
Where is M81 a nearly face-on spiral galaxy 11.8 million light-years from?	-0.5212
Where is depiction that has linked to the constellation of Orion a prehistoric mammoth ivory carving found in a cave in the Ach valley in?	-1.2157
Why was once work was completed, the telescope redeploy, typically after boosting to a higher orbit to address the orbital decay?	-0.5212
Did the Armenians identify The Armenians legendary patriarch?	-0.5212
How often does the Nile flood?	0.1733
How does Artemis flee as the constellation of a scorpion comes?	-1.2157
Do ω² Scorpii have contrasting blue?	-1.2157
Did orbit every 1078 days?	-1.2157
What is Polaris also known as?	1.5623
How much was the lens out of position?	-0.5212
What is Uranometria Argentina?	0.1733
When is the Flame Nebula discovered?	1.5623
Was in 1965 the astronomer Lyman Spitzer appointed as head of a committee given the task of defining scientific objectives for a large space telescope?	-1.2157
What is the closest star to the celestial north pole?	0.8678
Where does sirius A appear bright because of Sirius A intrinsic luminosity and Sirius A proximity to?	-0.5212
Did countries often adopt different cultures?	-1.2157
Was M80 the site of a rare discovery in 1860 when Arthur von Auwers discovered the nova T Scorpii?	-1.2157
When were the observations carried out on the telescope?	-1.2157
Does he hydeth the hugenesse of he quantite for unmevablenes of he place?	-1.2157
In 1922, who aided the IAU in dividing the celestial sphere into 88 official constellations?	-1.2157
Do the constellation's bright stars form a pattern like a longshoreman's hook?	0.1733
When did NASA develop plans for a space-based reflecting telescope with a mirror 3 m in diameter?	0.8678
What are the three kings often found in?	-1.2157
Who wrote the most complete works dealing with the mythical origins of the constellations?	0.8678
Did most notably the Three Stars Each texts?	-1.2157
Who was the first person to observe the faint companion Sirius B?	1.5623
What is the name of the collection of Marian poetry published by Nicolaus Lucensis in 1655?	1.5623
Were the Babylonians the first to recognize?	-1.2157
When was the Herschel Space Observatory launched?	1.5623
Is knowledge of The classical Zodiac also reflected in the Hebrew Bible?	1.5623
When did Moana appear?	-1.2157
When is the Orion Constellation not visible in Antarctica?	0.8678
Did called Sirius B. The distance separate Sirius A from Sirius A companion varies between 8.2?	-1.2157
Why is the consequence of this early date that?	-1.2157
What is the starburst phase of NGC 2787?	1.5623
Was at that time The name stella polaris well recognized?	-1.2157
What is the closest star to the northern celestial pole?	-1.2157
What is the dark nebula that forms the "emu in the sky"?	1.5623
What is Antares the rival of?	0.1733
Where is the Temple of Hathor located?	0.8678
Is the HST named after Hubble?	-0.5212
How does Ursae Majoris c orbit every 2391 days?	-1.2157
Is Scorpius name Latin for scorpion?	0.8678
How much data is sent to the Space Telescope Operations Control Center at Goddard Space Flight Center?	-0.5212
When did the National Academy of Sciences recommend that HST be preserved?	1.5623
The Odyssey is the sole constellation that never sinks below the horizon and "bathes in the waves" of what?	0.1733
Does the declination of Sirius match the latitude of the archipelago of Fiji at 17 ° S?	-0.5212
How have the constellations of different cultures and countries changed?	0.1733
Where is the "Big Dipper" located?	0.8678
What is the bright star in the middle of the Orion Constellation?	1.5623
When is the Scorpio of the tropical zodiac?	-0.5212
Why was the time allocated to the telescope limited to a few hours per cycle?	0.1733
The oldest Babylonian star catalogues date back to the beginning of what age?	-0.5212
Is another example the popular northern asterism known as the Big Dipper ?	-0.5212
When was the Hubble Space Telescope launched into low Earth orbit?	1.5623
Why did when the name stella polaris becomes the North Star again around 27,800 ad, due to the name stella polaris proper motion its proper motion then will?	-0.5212
Were others traditionally used only by various cultures?	-1.2157
What do the MAT-1 and MAT-2 components use?	-0.5212
Are the 88 modern constellations formally defined regions of the sky together covering the entire celestial sphere?	-1.2157
In which place be term Mazzaroth מַזָּרוֹת, a hapax legomenon 38:32, may the Hebrew word for the zodiacal constellations?	-1.2157
In the period May-July, Orion is in what time of the day and thus not visible at most latitudes?	-0.5212
What happened during the middle shang dynasty?	-1.2157
Are many of its common names allude commonly drawn to represent the hindquarters?	-1.2157
What did the German astronomer Friedrich Bessel deduce from the motion of Sirius that the German astronomer Friedrich Bessel had an unseen companion?	0.1733
What is the name of the Serer people in the Gambia?	0.8678
Is the main asterism invisible?	1.5623
When did Johannes Hevelius become a constellation?	0.1733
What is SN 2014J?	0.8678
Is Sirius A also known colloquially as the "Dog Star"?	0.8678
What was the bright star closest to the celestial pole?	0.8678
When were the constellation boundaries defined by the International Astronomical Union ?	0.1733
When is the star once designated Sco is known as Lib?	0.8678
What is the most famous dark cloud constellation?	1.5623
What is the Great Orion Nebula to the south?	0.1733
When was the Advanced Camera for Surveys used?	-1.2157
Is the Rig Veda said?	-1.2157
Does ursa Major occupy a large area covering 1279.66 square degrees?	-1.2157
May equatorial constellations include those that lie entirely between declinations 45 ° north?	-0.5212
How far away is Meissa from the Earth?	1.5623
Is informally known as the Delaware Diamond?	-1.2157
Is named from the Arabic?	-1.2157
The classical Zodiac is a product of a revision of the Old Babylonian system in later Neo-Babylonian astronomy 6th century BC.	-1.2157
What is the Orion Molecular Cloud Complex?	0.8678
When did Third Eye Blind name their fourth album Ursa Major?	0.1733
What was the first known Phoenician expedition?	1.5623
Is Scorpius an ancient constellation that pre-dated the Greeks?	-0.5212
What constellation borders Ursa Major to the east and southeast?	0.8678
What caused Phaeton to flee too high and encounter a scorpion?	-1.2157
When did Marcus Manilius write about Sirius as "sea-blue"?	0.8678
What is the current list of 88 constellations recognized by?	-0.5212
Were newer constellations in the far southern sky added much later during the 15th to mid-18th century?	-1.2157
Due to its declination of roughly −17 °, who is a circumpolar star from latitudes south of 73 ° S. From the Southern Hemisphere in early July, can be seen in both the evening where sets after the Sun , and in the morning where rises before the Sun ?	-0.5212
How old is I Zwicky 18?	-1.2157
Does precession cause the celestial poles to trace out circles on the celestial sphere approximately once every 26,000 years?	-1.2157
What happened to the discussion on Sirius Sirius with the publication of several papers in 1892, and a final summary in 1926?	-1.2157
What is Bellatrix?	0.1733
Have many other Polynesian names been recorded?	-1.2157
Have archaeologists estimated a prehistoric mammoth ivory carving found in a cave in the Ach valley in West Germany in 1979 to have been fashioned approximately 32,000 to 38,000 years ago?	-0.5212
Does have a significantly lower luminosity than other bright stars such as Canopus?	-1.2157
When is the Sun below the horizon in Antarctica?	1.5623
Where is the star 47 Ursae Majoris d located?	0.8678
Where was the Space Telescope European Coordinating Facility established?	1.5623
When did NGC 2787 star formation begin?	1.5623
What is NGC 2787?	0.1733
How far away is Gamma Cephei from the celestial north pole?	1.5623
When were the first observations of a third star published?	-1.2157
What is the Zodiac of Dendera?	0.1733
Were at that time ground-based telescopes limited to resolutions of 0.5–1.0 arcseconds?	-0.5212
Where is Scorpius located?	-0.5212
What is the name of the character in the movie Blade Runner?	-1.2157
Did hermann Oberth — consider a father of modern rocketry?	-1.2157
Where do the Chukchi people see Orion as a hunter?	-1.2157
When was Ursa Major listed by Ptolemy?	0.1733
Where is the Rigel located?	0.1733
How many meteors can be seen coming from the border with the Orion Constellation?	-1.2157
What is the oldest known Chinese star chart?	1.5623
What is the name of the star of unknown origin?	-1.2157
What are the two dogs that Orion is depicted with in his paintings?	-0.5212
What is the star W Ursae Majoris is a type of?	-1.2157
What is the map prepared during the Warring States period?	-0.5212
What does the term constellation specifically denote?	1.5623
The Pleiades and The Hyades are within the constellation of what?	0.8678
Was the fifth mission initially canceled on safety grounds following the Challenger disaster ?	-1.2157
Why are the western-traditional constellations the forty-eight Greek classical patterns?	-0.5212
What was the result of the Chinese Star Maps?	-0.5212
Did coins retrieve from the island from the 3rd century BC feature dogs?	-1.2157
Where was U.S. taxpayers saw the benefits of their investment in the space telescope program established at the Space Telescope European Coordinating Facility in?	-0.5212
When was the LST launched?	0.8678
What was the launch date for the Perkin-Elmer project?	1.5623
When did the name stella polaris have the declination +89°19′8′′ ?	-1.2157
